{
  "evidence_id": "redpanda-runtime",
  "status": "BLOCKED_EXTERNAL",
  "execution_level": "NOT_EXECUTED",
  "generated_at": "2026-07-23T00:00:00Z",
  "command": null,
  "environment": {
    "execution_context": "chat-container",
    "network": "restricted"
  },
  "result_summary": "Redpanda/Kafka runtime and container engine unavailable",
  "source_artifacts": [
    "02-events/asyncapi.yaml",
    "09-runbooks/integration-evidence-gate.md"
  ],
  "artifact_sha256": null,
  "blocked_reason": "Redpanda/Kafka runtime and container engine unavailable",
  "tool_versions": {},
  "required_execution_level": "EXTERNAL_INTEGRATION_EXECUTED"
}
