{
  "evidence_id": "kubernetes-runtime",
  "status": "BLOCKED_EXTERNAL",
  "execution_level": "NOT_EXECUTED",
  "generated_at": "2026-07-23T00:00:00Z",
  "command": null,
  "environment": {
    "execution_context": "chat-container",
    "network": "restricted"
  },
  "result_summary": "Helm, kubeconform and Kubernetes cluster unavailable",
  "source_artifacts": [
    "05-infra/helm/Chart.yaml",
    "09-runbooks/integration-evidence-gate.md"
  ],
  "artifact_sha256": null,
  "blocked_reason": "Helm, kubeconform and Kubernetes cluster unavailable",
  "tool_versions": {},
  "required_execution_level": "EXTERNAL_INTEGRATION_EXECUTED"
}
